{
  "definitions": {},
  "$schema": "http://json-schema.org/draft-07/schema#",
  "$id": "http://example.com/root.json",
  "type": "object",
  "title": "Server",
  "required": [
    "name",
    "owner",
    "contact",
    "lastUpdated",
    "datacenter",
    "purpose",
    "os",
    "firmware",
    "ip"
  ],
  "properties": {
    "name": {
      "type": "string",
      "title": "The Name Schema",
      "default": "",
      "pattern": "^(.*)$"
    },
    "owner": {
      "type": "string",
      "title": "The Owner Schema",
      "default": "",
      "pattern": "^(.*)$"
    },
    "contact": {
      "type": "string",
      "title": "The Contact Schema",
      "default": "",
      "pattern": "^(.*)$"
    },
    "lastUpdated": {
      "type": "string",
      "title": "The Lastupdated Schema",
      "default": "",
      "pattern": "^(.*)$"
    },
    "datacenter": {
      "type": "object",
      "title": "The Datacenter Schema",
      "required": ["$ref"],
      "properties": {
        "$ref": {
          "type": "string",
          "title": "The $ref Schema",
          "default": "",
          "pattern": "^(.*)$"
        }
      }
    },
    "purpose": {
      "type": "string",
      "title": "The Purpose Schema",
      "default": "",
      "pattern": "^(.*)$"
    },
    "os": {
      "type": "string",
      "title": "The Os Schema",
      "default": "",
      "pattern": "^(.*)$"
    },
    "firmware": {
      "type": "string",
      "title": "The Firmware Schema",
      "default": "",
      "pattern": "^(.*)$"
    },
    "ip": {
      "type": "string",
      "title": "The Ip Schema",
      "default": "",
      "pattern": "^(.*)$"
    }
  }
}
